quote,author
"Success is not final, failure is not fatal: it is the courage to continue that counts.",Winston Churchill
"Life is what happens to you while you're busy making other plans.",John Lennon
"Be the change you wish to see in the world.",Mahatma Gandhi
"Happiness is not something ready made. It comes from your own actions.",Dalai Lama
"Believe you can and you're halfway there.",Theodore Roosevelt
"In three words I can sum up everything I've learned about life: it goes on.",Robert Frost
"I have not failed. I've just found 10,000 ways that won't work.",Thomas Edison
"To be yourself in a world that is constantly trying to make you something else is the greatest accomplishment.",Ralph Waldo Emerson
"I can't change the direction of the wind, but I can adjust my sails to always reach my destination.",Jimmy Dean
"The greatest glory in living lies not in never falling, but in rising every time we fall.",Nelson Mandela
"The only way to do great work is to love what you do.",Steve Jobs
"Don't judge each day by the harvest you reap but by the seeds that you plant.",Robert Louis Stevenson
"Everything you can imagine is real.",Pablo Picasso
"The only thing necessary for the triumph of evil is for good men to do nothing.",Edmund Burke
"I have a dream that one day this nation will rise up and live out the true meaning of its creed: 'We hold these truths to be self-evident, that all men are created equal.'",Martin Luther King Jr.
"The mind is everything. What you think you become.",Buddha
"You miss 100% of the shots you don't take.",Wayne Gretzky
"If you want to go fast, go alone. If you want to go far, go together.",African proverb
"Twenty years from now you will be more disappointed by the things you didn't do than by the ones you did do.",Mark Twain
"The only true wisdom is in knowing you know nothing.",Socrates
"You can't use up creativity. The more you use, the more you have.",Maya Angelou
"Believe in yourself and all that you are. Know that there is something inside you that is greater than any obstacle.",Christian D. Larson
"If you're not making mistakes, then you're not making decisions.",Catherine Cook
"The greatest wealth is to live content with little.",Plato
"Success is stumbling from failure to failure with no loss of enthusiasm.",Winston Churchill
"Life is a journey, not a destination.",Ralph Waldo Emerson
"Change your thoughts and you change your world.",Norman Vincent Peale
"The best way to predict your future is to create it.",Abraham Lincoln
"Our greatest weakness lies in giving up. The most certain way to succeed is always to try just one more time.",Thomas Edison
"In the end, it's not the years in your life that count. It's the life in your years.",Abraham Lincoln
"If you want to live a happy life, tie it to a goal, not to people or things.",Albert Einstein
"If you can dream it, you can achieve it.",Zig Ziglar
"Knowing is not enough; we must apply. Willing is not enough; we must do.",Johann Wolfgang von Goethe
"Success consists of going from failure to failure without loss of enthusiasm.",Winston Churchill
"Life is 10% what happens to us and 90% how we react to it.",Charles
i am awesome,Nathan
"If you want to be happy, be." - Leo Tolstoy
"I would rather die of passion than of boredom." - Vincent van Gogh
"You can't use up creativity. The more you use, the more you have." - Maya Angelou
"The journey of a thousand miles begins with one step." - Lao Tzu
"The only thing necessary for the triumph of evil is for good men to do nothing." - Edmund Burke
"Life is 10% what happens to us and 90% how we react to it." - Charles R. Swindoll
"The best revenge is massive success." - Frank Sinatra
"I am not a product of my circumstances. I am a product of my decisions." - Stephen Covey
"To live is the rarest thing in the world. Most people exist, that is all." - Oscar Wilde
"The way to get started is to quit talking and begin doing." - Walt Disney
"We must be the change we wish to see in the world." - Mahatma Gandhi
"Believe you can and you're halfway there." - Theodore Roosevelt
"If you want to live a happy life, tie it to a goal, not to people or things." - Albert Einstein
"The future belongs to those who believe in the beauty of their dreams." - Eleanor Roosevelt
"Happiness is not something ready-made. It comes from your own actions." - Dalai Lama
"The best way to predict your future is to create it." - Abraham Lincoln
"If you don't stand for something, you will fall for anything." - Malcolm X
"The most courageous act is still to think for yourself. Aloud." - Coco Chanel
"Success is not the key to happiness. Happiness is the key to success. If you love what you are doing, you will be successful." - Albert Schweitzer
"The only true wisdom is in knowing you know nothing." - Socrates
"Your time is limited, don't waste it living someone else's life." - Steve Jobs
"If you want to make peace with your enemy, you have to work with your enemy. Then he becomes your partner." - Nelson Mandela
"It does not matter how slowly you go as long as you do not stop." - Confucius
"The only way to have a good idea is to have a lot of ideas." - Linus Pauling
"In three words I can sum up everything I've learned about life: it goes on." - Robert Frost
"Happiness is not a destination, it's a journey." - Zig Ziglar
"A mind that is stretched by a new experience can never go back to its old dimensions." - Oliver Wendell Holmes Jr.
"If you want to be happy, be." - Leo Tolstoy
"I would rather die of passion than of boredom." - Vincent van Gogh
"You can't use up creativity. The more you use, the more you have." - Maya Angelou
"The greatest wealth is to live content with little." - Plato
"It is not that we have a short time to live, but that we waste a lot of it." - Seneca
"The key is to keep company only with people who uplift you, whose presence calls forth your best." - Epictetus
"The happiness of your life depends upon the quality of your thoughts." - Marcus Aurelius
"We suffer more often in imagination than in reality." - Seneca
"Wealth consists not in having great possessions, but in having few wants." - Epictetus
"He who is not a good servant will not be a good master." - Seneca
"No man is free who is not master of himself." - Epictetus
"The first rule is to keep an untroubled spirit. The second is to look things in the face and know them for what they are." - Marcus Aurelius
"It is not death that a man should fear, but he should fear never beginning to live." - Marcus Aurelius
"If you are pained by any external thing, it is not this thing that disturbs you, but your own judgment about it. And it is in your power to wipe out that judgment now." - Marcus Aurelius
"We are more often frightened than hurt; and we suffer more from imagination than from reality." - Seneca
"Do not waste what remains of your life in speculating about your neighbors, unless with a view to some mutual benefit." - Marcus Aurelius
"To be everywhere is to be nowhere." - Seneca
"It is not what happens to you, but how you react to it that matters." - Epictetus
"It is not that we have a short time to live, but that we waste a lot of it." - Seneca
"The mind unlearns with difficulty what it has long learned." - Seneca
"The whole future lies in uncertainty: live immediately." - Seneca
"The wise man sees in the misfortune of others what he should avoid." - Marcus Aurelius
"The object of life is not to be on the side of the majority, but to escape finding oneself in the ranks of the insane." - Marcus Aurelius
"If you want to go fast, go alone. If you want to go far, go together." - African Proverb
"A man who makes trouble for others is also making trouble for himself." - Chinua Achebe
"Until the lion tells his side of the story, the tale of the hunt will always glorify the hunter." - African Proverb
"A tree cannot stand without roots." - Kenyan Proverb
"When there is no enemy within, the enemies outside cannot hurt you." - African Proverb
"One cannot both feast and become rich." - Ashanti Proverb
"If you educate a man you educate an individual, but if you educate a woman you educate a nation." - African Proverb
"The one who loves an unsightly person is the one who makes him beautiful." - African Proverb
"Unity is strength, division is weakness." - Swahili Proverb
"He who wants to eat honey should be prepared to be stung by bees." - Kenyan Proverb
"No matter how dark the night, morning always comes." - African Proverb
"An army of sheep led by a lion can defeat an army of lions led by a sheep." - African Proverb
"When a king has good counselors, his reign is peaceful." - African Proverb
"You cannot climb a mountain without breaking some eggs." - Ugandan Proverb
"The wise create proverbs for fools to learn, not to repeat." - African Proverb
"Knowledge is like a garden: if it is not cultivated, it cannot be harvested." - African Proverb
"Patience can cook a stone." - African Proverb
"The fool speaks, the wise man listens." - Ethiopian Proverb
"Smooth seas do not make skillful sailors." - African Proverb
"He who is unable to dance says that the yard is stony." - African Proverb"Discipline is the bridge between goals and accomplishment." - Jim Rohn
"We don't have to be smarter than the rest, we have to be more disciplined than the rest." - Warren Buffett
"Discipline is the foundation upon which all success is built." - Unknown
"Discipline is the refining fire by which talent becomes ability." - Roy L. Smith
"Self-discipline is the ability to make yourself do what you should do, when you should do it, whether you feel like it or not." - Elbert Hubbard
"Discipline is the soul of an army. It makes small numbers formidable; procures success to the weak, and esteem to all." - George Washington
"Without self-discipline, success is impossible, period." - Lou Holtz
"Discipline is the difference between what you want now and what you want most." - Unknown
"Discipline is the bridge between goals and accomplishment." - Jim Rohn
"Discipline is the key to unlock the door to success." - Unknown
"Discipline is the foundation of a successful and well-rounded life." - Unknown
"Discipline is the fuel that drives the engine of success." - Unknown
"Discipline is the master key to success." - Unknown
"Discipline is the ability to do what needs to be done, even when you don't want to do it." - Unknown
"Discipline is the highest form of self-love." - Unknown
"Discipline is the art of making the soldiers fear their officers more than the enemy." - Claude Adrien Helvetius
"Discipline is the key to excellence." - Vince Lombardi
"Discipline yourself and others won't need to." - John Wooden
"Discipline is the bridge that takes you from goals to accomplishment." - Anthony Robbins
"Discipline is the foundation of all good habits." - Unknown
"Strategy without tactics is the slowest route to victory. Tactics without strategy is the noise before defeat." - Sun Tzu
"In war, as in peace, it is not permissible to look beyond the limits of human nature." - Clausewitz
"Strategy is not a fixed formula; it is a set of guidelines and principles." - Richard Rumelt
"The essence of strategy is choosing what not to do." - Michael Porter
